{
  "schema_version": 1,
  "id": "00000000-0000-4000-8000-000000000600",
  "session_id": "00000000-0000-4000-8000-000000000601",
  "snapshot_id": "00000000-0000-4000-8000-000000000602",
  "cue_position": {
    "cue_index": 9999,
    "last_entry_seq": 12
  },
  "entries": [
    {
      "seq": 1,
      "at": "2026-08-23T18:00:00Z",
      "kind": "cue",
      "cue_index": 0
    },
    {
      "seq": 2,
      "at": "2026-08-23T18:01:00Z",
      "kind": "freeze",
      "cue_index": 1
    },
    {
      "seq": 3,
      "at": "2026-08-23T18:02:00Z",
      "kind": "unfreeze",
      "cue_index": 2
    },
    {
      "seq": 4,
      "at": "2026-08-23T18:03:00Z",
      "kind": "blackout",
      "cue_index": 3
    },
    {
      "seq": 5,
      "at": "2026-08-23T18:04:00Z",
      "kind": "clear-blackout",
      "cue_index": 4
    },
    {
      "seq": 6,
      "at": "2026-08-23T18:05:00Z",
      "kind": "session-end",
      "cue_index": 5
    },
    {
      "seq": 7,
      "at": "2026-08-23T18:06:00Z",
      "kind": "cue",
      "cue_index": 6
    },
    {
      "seq": 8,
      "at": "2026-08-23T18:07:00Z",
      "kind": "freeze",
      "cue_index": 7
    },
    {
      "seq": 9,
      "at": "2026-08-23T18:08:00Z",
      "kind": "unfreeze",
      "cue_index": 8
    },
    {
      "seq": 10,
      "at": "2026-08-23T18:09:00Z",
      "kind": "blackout",
      "cue_index": 9
    },
    {
      "seq": 11,
      "at": "2026-08-23T18:10:00Z",
      "kind": "clear-blackout",
      "cue_index": 10
    },
    {
      "seq": 12,
      "at": "2026-08-23T18:11:00Z",
      "kind": "cue",
      "cue_index": 9999
    }
  ],
  "entries_fingerprint": "98caf75146a5dd49e0bee9d7ec3330f33d581bfda3a38dd89aeb3ea98da3f305"
}
