{
  "schema_version": 1,
  "id": "00000000-0000-4000-8000-000000000600",
  "session_id": "00000000-0000-4000-8000-000000000601",
  "snapshot_id": "00000000-0000-4000-8000-000000000602",
  "cue_position": {
    "cue_index": 0,
    "last_entry_seq": 0
  },
  "entries": [],
  "entries_fingerprint": "e3b0c44298fc1c149afbf4c8996fb92427ae41e4649b934ca495991b7852b855"
}
